{
  "$schema": "http://json-schema.org/draft-07/schema#",
  "title": "Chamber Configuration",
  "description": "Configuration for deploying a customer environment (chamber) based on SOW requirements",
  "type": "object",
  "required": [
    "customer_name",
    "environment_tier",
    "compute",
    "storage",
    "networking",
    "services"
  ],
  "properties": {
    "customer_name": {
      "type": "string",
      "description": "Name of the customer from the SOW"
    },
    "environment_tier": {
      "type": "string",
      "enum": ["small", "medium", "large", "enterprise"],
      "description": "Overall environment size tier"
    },
    "compute": {
      "type": "object",
      "required": ["instance_type", "instance_count", "vcpus_per_instance", "memory_gb_per_instance"],
      "properties": {
        "instance_type": {
          "type": "string",
          "description": "GCP machine type, e.g. e2-standard-4, n2-standard-8"
        },
        "instance_count": {
          "type": "integer",
          "minimum": 1
        },
        "vcpus_per_instance": {
          "type": "integer",
          "minimum": 1
        },
        "memory_gb_per_instance": {
          "type": "integer",
          "minimum": 1
        }
      }
    },
    "storage": {
      "type": "object",
      "required": ["storage_type", "total_storage_gb", "iops_required"],
      "properties": {
        "storage_type": {
          "type": "string",
          "enum": ["pd-standard", "pd-ssd", "pd-balanced"]
        },
        "total_storage_gb": {
          "type": "integer",
          "minimum": 10
        },
        "iops_required": {
          "type": "integer",
          "minimum": 0
        }
      }
    },
    "networking": {
      "type": "object",
      "required": ["vpc_cidr", "subnet_count", "load_balancer"],
      "properties": {
        "vpc_cidr": {
          "type": "string",
          "description": "CIDR block for the VPC, e.g. 10.0.0.0/16"
        },
        "subnet_count": {
          "type": "integer",
          "minimum": 1
        },
        "load_balancer": {
          "type": "boolean"
        }
      }
    },
    "services": {
      "type": "array",
      "items": {
        "type": "object",
        "required": ["service_name", "enabled"],
        "properties": {
          "service_name": {
            "type": "string"
          },
          "enabled": {
            "type": "boolean"
          },
          "configuration": {
            "type": "object",
            "description": "Service-specific configuration key-value pairs"
          }
        }
      },
      "description": "List of services to enable in the environment"
    },
    "high_availability": {
      "type": "boolean",
      "default": false
    },
    "backup_enabled": {
      "type": "boolean",
      "default": true
    },
    "estimated_users": {
      "type": "integer",
      "minimum": 0
    }
  }
}
